{
  "schema_version": "0.1.0",
  "experiment_id": "reference-session-replay-v1",
  "generated_at": "2026-08-10T03:00:00Z",
  "runner": {
    "id": "reference-experiment-runner",
    "version": "0.1.0",
    "command": "python3 labs/runner.py reference-session-replay-v1 --check"
  },
  "status": "passed",
  "summary": {
    "total_runs": 2,
    "successful_runs": 2,
    "failed_runs": 0,
    "criteria_passed": true
  },
  "criteria": [
    {
      "statement": "Both repetitions replay five events and record the declared fork and inherited-event counts.",
      "passed": true
    },
    {
      "statement": "Both repetitions return the expected answer and share one normalized Trace fingerprint.",
      "passed": true
    }
  ],
  "fixture_sha256": "d369431d683da5c2cad36bb6dc6f76d429c2efbdc29171d5c8d9d4d7c3c575aa",
  "prompt_sha256": "bafdff395bb00b3027f78b9eec80b803a5e79513c618cfeae2a8373c32848b8e",
  "runs": [
    {
      "run_id": "reference-session-replay-v1-run-001",
      "repetition": 1,
      "status": "passed",
      "trace_path": "labs/results/reference-session-replay-v1/run-001.trace.jsonl",
      "event_count": 7,
      "event_types": [
        "session.start",
        "user.message",
        "model.request",
        "model.response",
        "session.stop",
        "session.replay",
        "session.branch"
      ],
      "final_text": "Replay derives state; branching preserves its parent.",
      "stop_reason": "completed",
      "metrics": {
        "event-order-valid": true,
        "observations-match": true,
        "final-answer-match": true,
        "fixture-unchanged": true,
        "deterministic-replay": true
      },
      "deterministic_fingerprint": "acc0c48a153bfe73fd3048e034fb7c72cf8ac09eda32c61a71ec8d5f3eff0106",
      "redaction": {
        "status": "clean",
        "fields": []
      }
    },
    {
      "run_id": "reference-session-replay-v1-run-002",
      "repetition": 2,
      "status": "passed",
      "trace_path": "labs/results/reference-session-replay-v1/run-002.trace.jsonl",
      "event_count": 7,
      "event_types": [
        "session.start",
        "user.message",
        "model.request",
        "model.response",
        "session.stop",
        "session.replay",
        "session.branch"
      ],
      "final_text": "Replay derives state; branching preserves its parent.",
      "stop_reason": "completed",
      "metrics": {
        "event-order-valid": true,
        "observations-match": true,
        "final-answer-match": true,
        "fixture-unchanged": true,
        "deterministic-replay": true
      },
      "deterministic_fingerprint": "acc0c48a153bfe73fd3048e034fb7c72cf8ac09eda32c61a71ec8d5f3eff0106",
      "redaction": {
        "status": "clean",
        "fields": []
      }
    }
  ],
  "limitations": [
    "The event log is in-memory teaching data rather than a crash-tested production store.",
    "The probe does not cover schema migrations, concurrent writers, or corrupted logs.",
    "The Reference Harness result is not Native vendor evidence."
  ]
}
